{
  "generated_for_branch": "001-sdk-quality-audit",
  "rows": [
    {
      "cells": {
        "I": "n/a",
        "II": "n/a",
        "III": "n/a",
        "IV": "yes",
        "V": "n/a",
        "VI": "n/a"
      },
      "file": "package.json",
      "finding_ids": []
    },
    {
      "cells": {
        "I": "n/a",
        "II": "n/a",
        "III": "n/a",
        "IV": "n/a",
        "V": "n/a",
        "VI": "n/a"
      },
      "file": "scripts/audit-changelog.ts",
      "finding_ids": []
    },
    {
      "cells": {
        "I": "n/a",
        "II": "n/a",
        "III": "n/a",
        "IV": "n/a",
        "V": "n/a",
        "VI": "n/a"
      },
      "file": "scripts/audit-compliance.ts",
      "finding_ids": []
    },
    {
      "cells": {
        "I": "n/a",
        "II": "n/a",
        "III": "n/a",
        "IV": "n/a",
        "V": "n/a",
        "VI": "n/a"
      },
      "file": "scripts/audit-consistency.ts",
      "finding_ids": []
    },
    {
      "cells": {
        "I": "n/a",
        "II": "n/a",
        "III": "n/a",
        "IV": "n/a",
        "V": "n/a",
        "VI": "n/a"
      },
      "file": "scripts/audit-docs.ts",
      "finding_ids": []
    },
    {
      "cells": {
        "I": "n/a",
        "II": "n/a",
        "III": "n/a",
        "IV": "n/a",
        "V": "n/a",
        "VI": "n/a"
      },
      "file": "scripts/audit-lib/ast.ts",
      "finding_ids": []
    },
    {
      "cells": {
        "I": "n/a",
        "II": "n/a",
        "III": "n/a",
        "IV": "n/a",
        "V": "n/a",
        "VI": "n/a"
      },
      "file": "scripts/audit-lib/findings.ts",
      "finding_ids": []
    },
    {
      "cells": {
        "I": "n/a",
        "II": "n/a",
        "III": "n/a",
        "IV": "n/a",
        "V": "n/a",
        "VI": "n/a"
      },
      "file": "scripts/audit-lib/git.ts",
      "finding_ids": []
    },
    {
      "cells": {
        "I": "n/a",
        "II": "n/a",
        "III": "n/a",
        "IV": "n/a",
        "V": "n/a",
        "VI": "n/a"
      },
      "file": "scripts/audit-lib/render.ts",
      "finding_ids": []
    },
    {
      "cells": {
        "I": "n/a",
        "II": "n/a",
        "III": "n/a",
        "IV": "n/a",
        "V": "n/a",
        "VI": "n/a"
      },
      "file": "scripts/audit-lib/types.ts",
      "finding_ids": []
    },
    {
      "cells": {
        "I": "n/a",
        "II": "n/a",
        "III": "n/a",
        "IV": "n/a",
        "V": "n/a",
        "VI": "n/a"
      },
      "file": "scripts/audit.ts",
      "finding_ids": []
    },
    {
      "cells": {
        "I": "n/a",
        "II": "n/a",
        "III": "n/a",
        "IV": "n/a",
        "V": "n/a",
        "VI": "n/a"
      },
      "file": "scripts/check-spec-update.ts",
      "finding_ids": []
    },
    {
      "cells": {
        "I": "n/a",
        "II": "n/a",
        "III": "n/a",
        "IV": "n/a",
        "V": "n/a",
        "VI": "n/a"
      },
      "file": "scripts/check-test-coverage.ts",
      "finding_ids": []
    },
    {
      "cells": {
        "I": "n/a",
        "II": "n/a",
        "III": "n/a",
        "IV": "n/a",
        "V": "n/a",
        "VI": "n/a"
      },
      "file": "scripts/diff-spec.ts",
      "finding_ids": []
    },
    {
      "cells": {
        "I": "n/a",
        "II": "n/a",
        "III": "n/a",
        "IV": "n/a",
        "V": "n/a",
        "VI": "n/a"
      },
      "file": "scripts/generate-types.ts",
      "finding_ids": []
    },
    {
      "cells": {
        "I": "n/a",
        "II": "n/a",
        "III": "n/a",
        "IV": "n/a",
        "V": "n/a",
        "VI": "n/a"
      },
      "file": "scripts/oauth-token.ts",
      "finding_ids": []
    },
    {
      "cells": {
        "I": "n/a",
        "II": "n/a",
        "III": "n/a",
        "IV": "n/a",
        "V": "n/a",
        "VI": "n/a"
      },
      "file": "scripts/verify-endpoints.ts",
      "finding_ids": []
    },
    {
      "cells": {
        "I": "n/a",
        "II": "n/a",
        "III": "yes",
        "IV": "n/a",
        "V": "no",
        "VI": "n/a"
      },
      "file": "src/client.ts",
      "finding_ids": [
        "a1efe1a403b7d831",
        "b0f2a062e828281a",
        "317f220ee8378e37"
      ]
    },
    {
      "cells": {
        "I": "n/a",
        "II": "n/a",
        "III": "yes",
        "IV": "n/a",
        "V": "yes",
        "VI": "n/a"
      },
      "file": "src/errors.ts",
      "finding_ids": []
    },
    {
      "cells": {
        "I": "n/a",
        "II": "n/a",
        "III": "yes",
        "IV": "n/a",
        "V": "yes",
        "VI": "n/a"
      },
      "file": "src/helpers/custom-fields.ts",
      "finding_ids": []
    },
    {
      "cells": {
        "I": "n/a",
        "II": "n/a",
        "III": "yes",
        "IV": "n/a",
        "V": "yes",
        "VI": "n/a"
      },
      "file": "src/index.ts",
      "finding_ids": []
    },
    {
      "cells": {
        "I": "n/a",
        "II": "n/a",
        "III": "yes",
        "IV": "n/a",
        "V": "yes",
        "VI": "n/a"
      },
      "file": "src/oauth.ts",
      "finding_ids": []
    },
    {
      "cells": {
        "I": "n/a",
        "II": "n/a",
        "III": "yes",
        "IV": "n/a",
        "V": "no",
        "VI": "n/a"
      },
      "file": "src/paginator.ts",
      "finding_ids": [
        "315f1b37a6a17009"
      ]
    },
    {
      "cells": {
        "I": "n/a",
        "II": "n/a",
        "III": "yes",
        "IV": "n/a",
        "V": "yes",
        "VI": "yes"
      },
      "file": "src/resources/accounts.ts",
      "finding_ids": []
    },
    {
      "cells": {
        "I": "n/a",
        "II": "n/a",
        "III": "yes",
        "IV": "n/a",
        "V": "yes",
        "VI": "yes"
      },
      "file": "src/resources/activity-types.ts",
      "finding_ids": []
    },
    {
      "cells": {
        "I": "n/a",
        "II": "n/a",
        "III": "yes",
        "IV": "n/a",
        "V": "yes",
        "VI": "n/a"
      },
      "file": "src/resources/base.ts",
      "finding_ids": []
    },
    {
      "cells": {
        "I": "n/a",
        "II": "n/a",
        "III": "yes",
        "IV": "n/a",
        "V": "yes",
        "VI": "yes"
      },
      "file": "src/resources/bookkeeping-submissions.ts",
      "finding_ids": []
    },
    {
      "cells": {
        "I": "n/a",
        "II": "n/a",
        "III": "yes",
        "IV": "n/a",
        "V": "yes",
        "VI": "yes"
      },
      "file": "src/resources/business-types.ts",
      "finding_ids": []
    },
    {
      "cells": {
        "I": "n/a",
        "II": "n/a",
        "III": "yes",
        "IV": "n/a",
        "V": "yes",
        "VI": "yes"
      },
      "file": "src/resources/call-outcomes.ts",
      "finding_ids": []
    },
    {
      "cells": {
        "I": "n/a",
        "II": "n/a",
        "III": "yes",
        "IV": "n/a",
        "V": "yes",
        "VI": "partial"
      },
      "file": "src/resources/calls.ts",
      "finding_ids": [
        "f1e64031e524514a"
      ]
    },
    {
      "cells": {
        "I": "n/a",
        "II": "n/a",
        "III": "yes",
        "IV": "n/a",
        "V": "yes",
        "VI": "yes"
      },
      "file": "src/resources/closing-days.ts",
      "finding_ids": []
    },
    {
      "cells": {
        "I": "n/a",
        "II": "n/a",
        "III": "yes",
        "IV": "n/a",
        "V": "yes",
        "VI": "yes"
      },
      "file": "src/resources/cloud-platforms.ts",
      "finding_ids": []
    },
    {
      "cells": {
        "I": "n/a",
        "II": "n/a",
        "III": "yes",
        "IV": "n/a",
        "V": "yes",
        "VI": "yes"
      },
      "file": "src/resources/commercial-discounts.ts",
      "finding_ids": []
    },
    {
      "cells": {
        "I": "n/a",
        "II": "n/a",
        "III": "yes",
        "IV": "n/a",
        "V": "yes",
        "VI": "yes"
      },
      "file": "src/resources/companies.ts",
      "finding_ids": []
    },
    {
      "cells": {
        "I": "n/a",
        "II": "n/a",
        "III": "yes",
        "IV": "n/a",
        "V": "yes",
        "VI": "yes"
      },
      "file": "src/resources/contacts.ts",
      "finding_ids": []
    },
    {
      "cells": {
        "I": "n/a",
        "II": "n/a",
        "III": "yes",
        "IV": "n/a",
        "V": "yes",
        "VI": "yes"
      },
      "file": "src/resources/credit-notes.ts",
      "finding_ids": []
    },
    {
      "cells": {
        "I": "n/a",
        "II": "n/a",
        "III": "yes",
        "IV": "n/a",
        "V": "yes",
        "VI": "yes"
      },
      "file": "src/resources/currencies.ts",
      "finding_ids": []
    },
    {
      "cells": {
        "I": "n/a",
        "II": "n/a",
        "III": "yes",
        "IV": "n/a",
        "V": "yes",
        "VI": "yes"
      },
      "file": "src/resources/custom-field-definitions.ts",
      "finding_ids": []
    },
    {
      "cells": {
        "I": "n/a",
        "II": "n/a",
        "III": "yes",
        "IV": "n/a",
        "V": "yes",
        "VI": "yes"
      },
      "file": "src/resources/day-off-types.ts",
      "finding_ids": []
    },
    {
      "cells": {
        "I": "n/a",
        "II": "n/a",
        "III": "yes",
        "IV": "n/a",
        "V": "yes",
        "VI": "yes"
      },
      "file": "src/resources/days-off.ts",
      "finding_ids": []
    },
    {
      "cells": {
        "I": "n/a",
        "II": "n/a",
        "III": "yes",
        "IV": "n/a",
        "V": "yes",
        "VI": "yes"
      },
      "file": "src/resources/deal-phases.ts",
      "finding_ids": []
    },
    {
      "cells": {
        "I": "n/a",
        "II": "n/a",
        "III": "yes",
        "IV": "n/a",
        "V": "yes",
        "VI": "yes"
      },
      "file": "src/resources/deal-pipelines.ts",
      "finding_ids": []
    },
    {
      "cells": {
        "I": "n/a",
        "II": "n/a",
        "III": "yes",